{
  "schemaVersion": 1,
  "meta": {
    "spielname": "Die letzten Wälle",
    "kapitel": 1,
    "zeit": {
      "jahreszeit": "Sommer",
      "jahr": 7
    },
    "rundeOffen": true,
    "weltereignis": "offen",
    "visualStyle": "Düster-realistischer Nordländer-Stil, gedämpfte Graublau- und Erdtöne, Nebel über dunklem Wasser, raues Holz und Eisen, kaltes Tageslicht; gemalt, körnig, Witcher-/Sagen-Ernst, kein Glanz, keine Heroik-Pose.",
    "mapStyle": "Gezeichnete Pergament-Seekarte des hohen Nordens, gedämpfte Farben, eine enge Förde zwischen steilen Kiefernhängen, Symbole für Mauer, Wald und Wracks, alt und abgegriffen."
  },
  "volk": {
    "name": "Vargvik, die Wolfsbucht",
    "wesensart": "Unbeugsam hinter der Mauer: +2 auf alles Halten, Aushalten, Verteidigen — −2 auf alles Offene: Aufbruch, Fahrt, Erkundung, Verhandlung nach außen. Ein Volk, das nur noch Mauern kennt.",
    "ausrichtung": "Belagert, defensiv, auf bloßes Überleben gestellt; lebt allein vom Fischfang, kein Handel, das alte Wissen verloren.",
    "erscheinung": "Eine kleine Wikingerstadt aus Holz und Stein über einer engen Förde: Palisadenwall, Räucherhütten, ein Häuflein müder Schildträger, Rauch über grauen Dächern, dahinter dunkler Wald.",
    "region": {
      "name": "Der Vargfjord, eine enge Förde im hohen Norden",
      "gelaendewerte": [
        {
          "key": "Fjord-Enge, gut zu verteidigen",
          "value": 2
        },
        {
          "key": "karger Boden, nur Fisch",
          "value": -1
        },
        {
          "key": "isoliert, Seewege abgeschnitten",
          "value": -1
        }
      ]
    }
  },
  "status": {
    "text": "Du bist Philipp mit den schwarzen Locken, Hauptmann der Wache von Vargvik. Ein gelernter Lederer, der sich Stufe um Stufe in der Wehr hochgearbeitet hat — handwerklich geschickt, erfahren im Kampf, von der Mannschaft anerkannt. Nicht der Jarl, aber die Hand, die die Mauer hält; auf dich schaut der Rat, wenn die Wiedergänger kommen. An deiner Seite ein ergebener Kern: deine Brüder Christopher (der mit den Geistern spricht und die Kunst hält) und Stephan (Redner und Taktiker) sowie deine Söhne Finn (junger Hauptmann an der Mauer) und Felix (Späher).",
    "ansehen": {
      "stufe": 1,
      "label": "Hauptmann, der die Mauer hält"
    }
  },
  "grundgroessen": {
    "nahrung": 1,
    "material": 1,
    "wissen": 1,
    "bevoelkerung": {
      "zahl": 100,
      "label": "Seelen in Vargvik — etwa 24 wehrfähige Schildträger an der Mauer, ~16 Fischer und Handwerker, der Rest Frauen, Alte, Kinder und Versehrte; jeden Winter weniger"
    }
  },
  "lagewerte": {
    "verteidigung": 0,
    "mobilitaet": -1,
    "wohlstand": -2,
    "ausbeuten": [
      {
        "key": "Fischfang (Förde)",
        "value": 1,
        "quelle": "die Boote der Halla"
      }
    ]
  },
  "lebenswelt": {
    "leben": {
      "stimmung": "Zäh und müde, am Rand der Verzweiflung; man hält, weil das Meer im Rücken keinen Ausweg lässt.",
      "nahrung": "Allein vom Fischfang — gepökelt und geräuchert; im Winter knapp und streng zugeteilt.",
      "trinken": "Dünnbier und Brunnenwasser; Met nur noch zu Toten- und Festriten.",
      "glaube": "Alte Nordgötter und Ahnengeister; Grímas Riten geben Halt, doch die Pest sät Zweifel an den Mächten.",
      "alltag": "Wachdienst an der Mauer im Wechsel, Netze flicken, Fisch räuchern — und die Toten verbrennen, ehe sie wiederkommen.",
      "braeuche": [
        "Totenverbrennung statt Bestattung, damit keiner wiedergeht",
        "Die Mauerwache im Wechsel, Tag und Nacht",
        "Das Räuchern als Gemeinschaftswerk der Fischerfamilien"
      ]
    },
    "siedlungen": [
      {
        "id": "vargvik",
        "name": "Vargvik, die Wolfsbucht",
        "hauptstadt": true,
        "typ": "Ummauerte Hafenstadt",
        "lage": "Über der Enge des Vargfjords, zwischen steilen Kiefernhängen; die offene See im Westen, der Schwarzwald im Osten.",
        "beschreibung": "Eine kleine Wikingerstadt aus Holz und Stein, geduckt hinter Palisadenwall und Ringmauer über der Förde. Rauch über grauen Dächern, Räucherhütten am Kai, ein Häuflein müder Schildträger auf dem Wehrgang; dahinter der dunkle Wald, aus dem es kommt.",
        "stimmung": "Müde Entschlossenheit hinter dem Wall — Trotz statt Hoffnung.",
        "versorgung": "Fisch, geräuchert und gepökelt; Dünnbier und Brunnenwasser.",
        "bauten": [
          "Ringmauer und Palisadenwall über der Fjord-Enge",
          "Räucherhütten am Kai",
          "Christophers Braukate",
          "Die Halle des Jarls",
          "Der Kai mit Hallas Fischerbooten"
        ],
        "eigenschaften": [
          {
            "key": "Fjord-Enge, gut zu verteidigen",
            "value": 2
          },
          {
            "key": "karger Boden, nur Fisch",
            "value": -1
          },
          {
            "key": "isoliert, kein Handel",
            "value": -1
          }
        ]
      }
    ]
  },
  "modifikatoren": {
    "gelaende": [
      {
        "key": "Fjord-Enge, gut zu verteidigen",
        "value": 2
      },
      {
        "key": "isoliert, kein Handel",
        "value": -1
      }
    ],
    "lage": [
      {
        "key": "jahrelange Belagerung, Erschöpfung der Wehr",
        "value": -1,
        "grund": "jeder Winter frisst mehr Verteidiger, als der Sommer ersetzt"
      },
      {
        "key": "verlorenes Wissen",
        "value": -1,
        "grund": "die alten Brauer sind tot, die Rezepte nur noch Fragmente"
      },
      {
        "key": "Misstrauen statt Meuterei",
        "value": -1,
        "grund": "Philipps Salzproben-Rede (Wurf 7) vertagte den Aufstand: die Wache griff nicht zu, doch die Spionen-Furcht — Wiedergänger in vertrauten Gesichtern — zersetzt nun den Zusammenhalt von innen"
      }
    ]
  },
  "faehigkeiten": [
    "Mauerwehr und Wallbau (das Handwerk Philipps und der Wache)",
    "Fischfang und Räuchern als einzige verlässliche Nahrung",
    "Reste der Kunst: fragmentarische Alchemie und Geisterzwiesprache in Christophers Händen",
    "Wiedergänger lebend fangen (Fangstangen-Schlinge, nutzt ihre Langsamkeit) — durch kritischen Coup erschlossen",
    "Forschungspfad zum Ursprung am lebenden Gefangenen: das Erkennen + die echte Salzprobe (mit Auðun +2 / Christopher +1)"
  ],
  "gruppen": [
    {
      "id": "wehr",
      "name": "Die Wache",
      "sprecherId": "brandr",
      "kompetenz": "Mauer, Waffen, Wachdienst"
    },
    {
      "id": "kunst",
      "name": "Die Brauer / die Kunst",
      "sprecherId": "christopher",
      "kompetenz": "Alchemie, Heilkunde, Kräuter, Geisterzwiesprache"
    },
    {
      "id": "fischer",
      "name": "Die Fischer und das Volk",
      "sprecherId": "halla",
      "kompetenz": "Fischfang, Versorgung, Stimmung des Volkes"
    },
    {
      "id": "hof",
      "name": "Der Hof des Jarls",
      "sprecherId": "jarl-harald",
      "kompetenz": "weltliche Führung, Recht, Vorräte"
    },
    {
      "id": "glaube",
      "name": "Die Seherkunst / der Glaube",
      "sprecherId": "grima",
      "kompetenz": "Vorzeichen, Riten, Moral des Volkes"
    },
    {
      "id": "spaeher",
      "name": "Die Späher / die Jugend",
      "sprecherId": "felix",
      "kompetenz": "Kundschaft jenseits der Mauer, Wagemut"
    }
  ],
  "berater": [
    {
      "id": "jarl-harald",
      "name": "Jarl Harald der Müde",
      "rolle": "Herr von Vargvik, weltliche Führung",
      "ziel": "Die Stadt um jeden Preis am Leben halten und seine Ordnung bewahren — lieber ein erniedrigender Handel als ein heldischer Untergang. Seine schlimmste Furcht ist eingetreten: die Wache als Tyrannei, ein Hauptmann, der seine Söhne mit Stahl auf loyale Männer hetzt und Verwundete foltert. Offene Gegnerschaft.",
      "loyalitaet": -2,
      "generation": "alt",
      "lebensstand": "lebensabend",
      "erscheinung": "grauer Bart, schwerer Fellmantel, ein steifes Bein; Augen, die nichts Gutes mehr erwarten."
    },
    {
      "id": "christopher",
      "name": "Christopher",
      "rolle": "Bruder Philipps; Druide und Alchemist der Stadt, der mit den Geistern spricht",
      "ziel": "Mit Geisterzwiesprache und Kunst den Ursprung der Pest ergründen und Vargvik retten; seinem Bruder bis zum Letzten ergeben. Sein Brauen und Geisterwandeln schürt jedoch Furcht und den Verdacht, die Kunst selbst nähre die Wiedergänger. Prüfte Auðuns Fachwissen und fand es echt — die beiden Brüder bilden nun die einzige konstruktive, nüchterne Achse in Vargvik.",
      "loyalitaet": 5,
      "generation": "mittel",
      "lebensstand": "ruestig",
      "erscheinung": "kräftiger Mann in den mittleren Jahren, helle, wettergegerbte Haut; kurzgeschorenes braunes Haar, an den Schläfen knapp geschoren, oben etwas voller; voller, gepflegter kurzer brauner Bart; helle, wache Augen und ein warmes, offenes Lächeln, das schlecht zu seinem oft abwesenden Druidenblick passt; anders als sein schwarzlockiger Bruder Philipp trägt er das Haar kurz. Fleckige Alchemistenhände, Amulette aus Knochen und Kupfer am Hals, gemurmelte Zwiesprache mit Unsichtbaren."
    },
    {
      "id": "stephan",
      "name": "Stephan",
      "rolle": "Bruder Philipps; Redner und Taktiker des Rates",
      "ziel": "Mit Wort und Klugheit die Stadt zusammenhalten und ihre Schläge lenken; dient seinem Bruder treu und stärkt dessen Hand im Rat. Versuchte den Faustschlag und den Bruderkampf aufzuhalten — bleibt treu, doch erschüttert; nach der Folter erkennt er seinen Bruder nicht wieder.",
      "loyalitaet": 2,
      "generation": "mittel",
      "lebensstand": "ruestig",
      "erscheinung": "breitschultrig, ruhige feste Stimme, gepflegter Bart; der, auf den der Rat hört, wenn die Stimmen laut werden."
    },
    {
      "id": "finn",
      "name": "Finn",
      "rolle": "Älterer Sohn Philipps; junger Hauptmann an der Mauer",